ชื่อสินค้า,ราคา,รูปภาพ,หมวดหมู่
LESASHA ไดร์เป่าผม AIRMAX THERAPY HAIR DRYER 2500W ปกป้องเส้นผม ลมแรง แห้งเร็ว น้ำหนักเบา LS1351,"฿3,390.00",https://lzd-img-global.slatic.net/g/p/09a69bb553f1927f710cb131a0349167.png_200x200q80.jpg_.webp,มาแรง
LESASHA ไดร์เป่าผม รุ่น AIRMAX SMART HAIR DRYER 2200W LS1354 ลมแรงแห้งไว,฿790.00,https://lzd-img-global.slatic.net/g/p/09a69bb553f1927f710cb131a0349167.png_80x80q80.jpg_.webp,มาแรง
IWACHI ไดร์เป่าผม GY-5100 1800W ปรับแรงลมได้ 2 ระดับ ปรับลมร้อน/เย็น (แถมหัวปรับทิศทางลม2หัว),฿145.00,https://lzd-img-global.slatic.net/g/p/2a568c2cf5f25c48144dfc5b104b30cf.png_200x200q80.jpg_.webp,มาแรง
ไดร์เป่าผม ไดร์ ไดร์เป๋าผมแบบพกพา เครื่องเป่าผม แห้งเร็ว ลมแรง ปรับลมได้2ระดับ พกพาสะดวก มีแสงสีฟ้า ผมไม่แห้งเสีย,฿208.00,https://lzd-img-global.slatic.net/g/p/2a568c2cf5f25c48144dfc5b104b30cf.png_80x80q80.jpg_.webp,มาแรง
LESASHA  ไดร์เป่าผม MAXI AIR HAIR DRYER 1800W รุ่น LS0663 ลมแรง มีลมเย็น ปรับอุณหภูมิได้ 6 ระดับ,฿713.44,https://lzd-img-global.slatic.net/g/p/d98947821e39f011033597de9a3c249f.jpg_200x200q80.jpg_.webp,มาแรง
Coolastyler มีลมเย็น มอเตอร์ญี่ปุ่น ไดร์เป่าผม ไดร์เป่าผมระดับมืออาชีพ hair dryer CA-1001 1200W ฮิตสุด ไดร์เป่าผม ปรับความร้อน แรงลมได้ เป่าผม รุ่นยอดฮิต ที่เป่าผม พกพา ไดรเป่าผม เป่าผม ไดร ไดร์เป่าผม,฿198.00,https://lzd-img-global.slatic.net/g/p/61dc6548cd4c10e835a6a69313cc66c4.jpg_80x80q80.jpg_.webp,มาแรง
